{
  "amount_max": 2000.0,
  "amount_min": 2000.0,
  "catalog_id": "ralph-c-gingles-jr-scholarship",
  "citizenship": null,
  "counties_allowed": [
    "Gaston"
  ],
  "cycle": {
    "deadline_month": 3,
    "opens_month": null,
    "recurring": true
  },
  "deadline": null,
  "description": "One-time $2,000 for a Gaston County senior headed to a four-year college, with an essay on Thornburg v. Gingles.",
  "disability": null,
  "education_level": "high school",
  "eligibility_text": "One Gaston County graduating high school student with a GPA of 3.0 unweighted or better, accepted to a four-year college/university, with financial need.",
  "employer_restricted": [],
  "first_gen_only": null,
  "gender": null,
  "grade_levels": [
    "12"
  ],
  "heritage": [],
  "keywords": [
    "gaston county",
    "voting rights",
    "essay"
  ],
  "majors_allowed": [],
  "membership_required": [],
  "military_family": null,
  "min_gpa": 3.0,
  "min_test_scores": {
    "act": null,
    "sat": null
  },
  "need_based": true,
  "notes": "Seeded 2026-09-26 by Claude (Catalog Integrity Task 2.2, Gaston/Mecklenburg pass). Not verified: open the source before setting trust to verified_local. Prefill proposed: amount_min=2000.0, amount_max=2000.0, min_gpa=3.0, counties_allowed=['Gaston'].",
  "provenance": {
    "added_on": "2026-09-26",
    "checked_by": null,
    "checked_on": null,
    "source_kind": "community_foundation",
    "verified_by": "daedwards06",
    "verified_on": "2026-09-26"
  },
  "religion": null,
  "renewal_terms": null,
  "requirements": {
    "essay": true,
    "essay_prompts": [
      "500 words minimum on the importance of Thornburg v. Gingles and its effects on voting rights."
    ],
    "fafsa": null,
    "interview": null,
    "recommendation_letters": null,
    "transcript": null,
    "video_or_portfolio": null
  },
  "source_url": "https://www.cfgaston.org/portfolio-item/ralph-c-gingles-jr-scholarship/",
  "sponsor": "Gaston Community Foundation",
  "states_allowed": [
    "NC"
  ],
  "status": "upcoming",
  "title": "Honorable Ralph C. Gingles, Jr. Scholarship",
  "trust": "verified_local"
}