{
  "amount_max": 2500.0,
  "amount_min": 2500.0,
  "catalog_id": "sam-and-ruth-beam-memorial-scholarship",
  "citizenship": null,
  "counties_allowed": [
    "Gaston",
    "Lincoln"
  ],
  "cycle": {
    "deadline_month": 3,
    "opens_month": null,
    "recurring": true
  },
  "deadline": null,
  "description": "$2,500 for one Gaston or Lincoln County senior pursuing a four-year degree.",
  "disability": null,
  "education_level": "high school",
  "eligibility_text": "Gaston or Lincoln County graduating senior pursuing a degree at a four-year college or university.",
  "employer_restricted": [],
  "first_gen_only": null,
  "gender": null,
  "grade_levels": [
    "12"
  ],
  "heritage": [],
  "keywords": [
    "gaston county",
    "lincoln county",
    "community service"
  ],
  "majors_allowed": [],
  "membership_required": [],
  "military_family": null,
  "min_gpa": null,
  "min_test_scores": {
    "act": null,
    "sat": null
  },
  "need_based": null,
  "notes": "Seeded 2026-09-26 by Claude (Catalog Integrity Task 2.2, Gaston/Mecklenburg pass). Not verified: open the source before setting trust to verified_local. Prefill proposed: amount_min=2500.0, amount_max=2500.0, counties_allowed=['Gaston', 'Lincoln'].",
  "provenance": {
    "added_on": "2026-09-26",
    "checked_by": null,
    "checked_on": null,
    "source_kind": "community_foundation",
    "verified_by": "daedwards06",
    "verified_on": "2026-09-26"
  },
  "religion": null,
  "renewal_terms": null,
  "requirements": {
    "essay": null,
    "essay_prompts": [],
    "fafsa": null,
    "interview": null,
    "recommendation_letters": null,
    "transcript": null,
    "video_or_portfolio": null
  },
  "source_url": "https://www.cfgaston.org/portfolio-item/sam-ruth-beam-memorial-scholarship/",
  "sponsor": "Gaston Community Foundation",
  "states_allowed": [
    "NC"
  ],
  "status": "upcoming",
  "title": "Sam L. and Ruth M. Beam Memorial Scholarship",
  "trust": "verified_local"
}