{
  "amount_max": 5000.0,
  "amount_min": 5000.0,
  "catalog_id": "afcea-cyber-security-scholarship",
  "citizenship": "US",
  "counties_allowed": [],
  "cycle": {
    "deadline_month": 5,
    "opens_month": null,
    "recurring": true
  },
  "deadline": null,
  "description": "A $5,000 award for a sophomore or junior in a cybersecurity-related major at a four-year accredited U.S. college.",
  "disability": null,
  "education_level": "undergraduate",
  "eligibility_text": "Must be an undergraduate student enrolled full-time at a four-year accredited U.S. college; online degree programs are eligible. Must be a sophomore or junior at the time of application. Must have a minimum overall GPA of 3.0 in their current academic program. Must be a U.S. citizen or permanent resident. Students attending a community college, freshmen and seniors are not eligible. Must also be enrolled in Cybersecurity, Computer Science, Digital Forensics, Information Assurance, or another field directly supporting U.S. cyber enterprises.",
  "employer_restricted": [],
  "first_gen_only": null,
  "gender": null,
  "grade_levels": [
    "college_2",
    "college_3"
  ],
  "heritage": [],
  "keywords": [
    "cybersecurity",
    "computer science",
    "STEM",
    "sophomore",
    "junior"
  ],
  "majors_allowed": [
    "Cybersecurity",
    "Computer Science",
    "Computer Engineering",
    "Information Technology"
  ],
  "membership_required": [],
  "military_family": null,
  "min_gpa": 3.0,
  "min_test_scores": {
    "act": null,
    "sat": null
  },
  "need_based": null,
  "notes": "Split out of the retired 'afcea-stem-scholarship' umbrella on 2026-09-19. The umbrella averaged 13 named awards into eligibility true of none of them. This is the named 'Cyber Security Scholarship ($5,000)' on the STEM Majors page; it is the $5,000 top of the retired umbrella's range. Page status on 2026-09-19: 'Applications closed!'. The page publishes no application deadline; 'no later than May 1, 2026' is the mailed-documents date for the closed cycle, recorded as cycle.deadline_month 5.",
  "provenance": {
    "added_on": "2026-09-19",
    "checked_by": "verify_catalog",
    "checked_on": "2026-09-26",
    "source_kind": "sponsor_site",
    "verified_by": "daedwards06",
    "verified_on": "2026-09-26"
  },
  "religion": null,
  "renewal_terms": null,
  "requirements": {
    "essay": null,
    "essay_prompts": [],
    "fafsa": null,
    "interview": null,
    "recommendation_letters": 1,
    "transcript": true,
    "video_or_portfolio": null
  },
  "source_url": "https://www.afcea.org/stem-majors-scholarships",
  "sponsor": "AFCEA Educational Foundation",
  "states_allowed": [],
  "status": "closed",
  "title": "AFCEA Cyber Security Scholarship",
  "trust": "verified_local"
}