{
  "amount_max": null,
  "amount_min": null,
  "catalog_id": "annable-scholarship",
  "citizenship": null,
  "counties_allowed": [],
  "cycle": {
    "deadline_month": 3,
    "opens_month": 12,
    "recurring": true
  },
  "deadline": "2027-03-05",
  "description": "Partial undergraduate funding for North Carolina residents (and residents of listed upstate South Carolina counties).",
  "disability": null,
  "education_level": "undergraduate",
  "eligibility_text": "Enrolled or planning to enroll full-time at a two- or four-year not-for-profit U.S. college; legal resident of North Carolina or of York, Cherokee, Spartanburg, Greenville, Laurens, Lancaster, Kershaw, Union, Chester, Chesterfield, Fairfield or Darlington County, SC; GPA 2.5 or higher; no felony drug conviction.",
  "employer_restricted": [],
  "first_gen_only": null,
  "gender": null,
  "grade_levels": [],
  "heritage": [],
  "keywords": [
    "north carolina",
    "undergraduate"
  ],
  "majors_allowed": [],
  "membership_required": [],
  "military_family": null,
  "min_gpa": 2.5,
  "min_test_scores": {
    "act": null,
    "sat": null
  },
  "need_based": null,
  "notes": "Seeded 2026-09-26 by Claude (Catalog Integrity Task 2.2, Gaston/Mecklenburg pass). Not verified: open the source before setting trust to verified_local. FFTC Fund ID 4334 (search the portal by name; FFTC fund pages are ASP.NET postbacks with no per-fund URL, so prefill cannot reach them).",
  "provenance": {
    "added_on": "2026-09-26",
    "checked_by": null,
    "checked_on": null,
    "source_kind": "community_foundation",
    "verified_by": "daedwards06",
    "verified_on": "2026-09-26"
  },
  "religion": null,
  "renewal_terms": null,
  "requirements": {
    "essay": null,
    "essay_prompts": [],
    "fafsa": null,
    "interview": null,
    "recommendation_letters": null,
    "transcript": null,
    "video_or_portfolio": null
  },
  "source_url": "https://fftcscholarships.communityforce.com/Funds/Search.aspx",
  "sponsor": "Foundation For The Carolinas",
  "states_allowed": [
    "NC",
    "SC"
  ],
  "status": "upcoming",
  "title": "The Annable Scholarship",
  "trust": "verified_local"
}