{
  "catalog_id": "dell-technologies-scholars-program",
  "title": "Dell Technologies Scholars Program",
  "sponsor": "Dell Technologies",
  "source_url": "https://www.dell.com/en-us/dt/foundation/scholarships.htm",
  "description": "The Dell Scholars Program supports students who have overcome obstacles and demonstrate a strong commitment to their education.",
  "eligibility_text": "US citizen or permanent resident. Participating in a college-ready program. Must demonstrate financial need. No state restrictions. Minimum 2.4 GPA required.",
  "amount_min": 20000.0,
  "amount_max": 20000.0,
  "deadline": "2027-12-01",
  "cycle": { "recurring": true, "opens_month": null, "deadline_month": 12 },
  "status": "unknown",
  "education_level": "high school",
  "grade_levels": ["12"],
  "majors_allowed": [],
  "states_allowed": [],
  "counties_allowed": [],
  "min_gpa": 2.4,
  "citizenship": "US",
  "need_based": true,
  "first_gen_only": null,
  "gender": null,
  "heritage": [],
  "military_family": null,
  "disability": null,
  "religion": null,
  "employer_restricted": [],
  "membership_required": [],
  "min_test_scores": { "sat": null, "act": null },
  "requirements": {
    "essay": true,
    "essay_prompts": [],
    "recommendation_letters": null,
    "transcript": true,
    "fafsa": true,
    "video_or_portfolio": null,
    "interview": null
  },
  "renewal_terms": null,
  "keywords": ["financial need", "first generation", "undergraduate", "technology", "national"],
  "trust": "unverified",
  "provenance": {
    "added_on": "2026-09-12",
    "verified_on": null,
    "verified_by": null,
    "source_kind": "sponsor_site"
  },
  "notes": "Migrated from data/static_feed/scholarships.json. Open to graduating high school seniors enrolled in an approved college-readiness program; deadline and status not yet confirmed against source_url."
}
