{
  "amount_max": 14000.0,
  "amount_min": 14000.0,
  "catalog_id": "golden-leaf-colleges-and-universities-scholarship",
  "citizenship": null,
  "counties_allowed": [
    "Alamance",
    "Alexander",
    "Alleghany",
    "Anson",
    "Ashe",
    "Avery",
    "Beaufort",
    "Bertie",
    "Bladen",
    "Burke",
    "Caldwell",
    "Camden",
    "Caswell",
    "Catawba",
    "Cherokee",
    "Chowan",
    "Clay",
    "Cleveland",
    "Columbus",
    "Craven",
    "Cumberland",
    "Dare",
    "Davidson",
    "Davie",
    "Duplin",
    "Edgecombe",
    "Franklin",
    "Gaston",
    "Gates",
    "Graham",
    "Granville",
    "Greene",
    "Halifax",
    "Harnett",
    "Haywood",
    "Hertford",
    "Hoke",
    "Hyde",
    "Jackson",
    "Johnston",
    "Jones",
    "Lee",
    "Lenoir",
    "Macon",
    "Madison",
    "Martin",
    "McDowell",
    "Mitchell",
    "Montgomery",
    "Nash",
    "Northampton",
    "Onslow",
    "Pamlico",
    "Pasquotank",
    "Perquimans",
    "Person",
    "Pitt",
    "Polk",
    "Randolph",
    "Richmond",
    "Robeson",
    "Rockingham",
    "Rowan",
    "Rutherford",
    "Sampson",
    "Scotland",
    "Stanly",
    "Stokes",
    "Surry",
    "Swain",
    "Transylvania",
    "Tyrrell",
    "Vance",
    "Warren",
    "Washington",
    "Watauga",
    "Wayne",
    "Wilkes",
    "Wilson",
    "Yadkin",
    "Yancey"
  ],
  "cycle": {
    "deadline_month": 3,
    "opens_month": 1,
    "recurring": true
  },
  "deadline": "2027-03-01",
  "description": "Four-year scholarship for graduating NC high school seniors from qualifying rural, economically distressed counties who enroll full-time at a participating NC college or university.",
  "disability": null,
  "education_level": "high school",
  "eligibility_text": "NC resident for tuition purposes; reside in a qualifying rural NC county; graduating NC high school senior enrolling full-time in the fall; minimum cumulative GPA 2.5; plan to enroll at a participating NC public or private college/university; FAFSA Student Aid Index of 15000 or less; commit to returning to a rural NC county after college.",
  "employer_restricted": [],
  "first_gen_only": null,
  "gender": null,
  "grade_levels": [
    "12"
  ],
  "heritage": [],
  "keywords": [
    "rural",
    "north carolina",
    "financial need"
  ],
  "majors_allowed": [],
  "membership_required": [],
  "military_family": null,
  "min_gpa": 2.5,
  "min_test_scores": {
    "act": null,
    "sat": null
  },
  "need_based": true,
  "notes": "Seeded 2026-09-26 by Claude through the Add Award prefill path (Catalog Integrity Task 2.2). Not verified: open the source page before setting trust to verified_local. Prefill missed: counties (the list is in a linked PDF; the page shows only 'Clay'); amount read as $3,500 (per year) rather than the $14,000 four-year total.",
  "provenance": {
    "added_on": "2026-09-26",
    "checked_by": null,
    "checked_on": null,
    "source_kind": "sponsor_site",
    "verified_by": "daedwards06",
    "verified_on": "2026-09-26"
  },
  "religion": null,
  "renewal_terms": "$3,500 a year for up to four years; renewal needs a Renewal Profile and FAFSA each year, continued need, full-time enrollment, and SAP.",
  "requirements": {
    "essay": null,
    "essay_prompts": [],
    "fafsa": true,
    "interview": null,
    "recommendation_letters": null,
    "transcript": true,
    "video_or_portfolio": null
  },
  "source_url": "https://scholars.goldenleaf.org/applicants/colleges-universities/",
  "sponsor": "Golden LEAF Foundation (administered by NCSEAA)",
  "states_allowed": [
    "NC"
  ],
  "status": "upcoming",
  "title": "Golden LEAF Colleges and Universities Scholarship",
  "trust": "verified_local"
}