{
  "catalog_id": "afcea-stem-scholarship",
  "title": "AFCEA STEM Scholarship",
  "sponsor": "Armed Forces Communications and Electronics Association",
  "source_url": "https://www.afcea.org/scholarships",
  "description": "AFCEA scholarships support students pursuing STEM degrees, especially those in cybersecurity, electrical engineering, and computer science.",
  "eligibility_text": "Open to US citizens enrolled full-time at accredited colleges and universities. Students majoring in computer science, cybersecurity, electrical engineering, or related fields. Available to students nationwide.",
  "amount_min": 2500.0,
  "amount_max": 5000.0,
  "deadline": "2027-04-01",
  "cycle": { "recurring": true, "opens_month": null, "deadline_month": 4 },
  "status": "unknown",
  "education_level": "undergraduate",
  "grade_levels": ["college_1", "college_2", "college_3", "college_4"],
  "majors_allowed": ["Computer Science", "Electrical Engineering", "Engineering"],
  "states_allowed": [],
  "counties_allowed": [],
  "min_gpa": null,
  "citizenship": "US",
  "need_based": null,
  "first_gen_only": null,
  "gender": null,
  "heritage": [],
  "military_family": null,
  "disability": null,
  "religion": null,
  "employer_restricted": [],
  "membership_required": [],
  "min_test_scores": { "sat": null, "act": null },
  "requirements": {
    "essay": true,
    "essay_prompts": [],
    "recommendation_letters": 1,
    "transcript": true,
    "fafsa": null,
    "video_or_portfolio": null,
    "interview": null
  },
  "renewal_terms": null,
  "keywords": ["cybersecurity", "computer science", "electrical engineering", "STEM", "US citizen", "national"],
  "trust": "unverified",
  "provenance": {
    "added_on": "2026-09-12",
    "verified_on": "2026-09-12",
    "verified_by": "verify_catalog",
    "source_kind": "sponsor_site"
  },
  "notes": "Migrated from data/static_feed/scholarships.json. AFCEA runs several named STEM awards behind one page; deadline and status not yet confirmed against source_url."
}
