{
  "catalog_id": "google-generation-scholarship",
  "title": "Google Generation Scholarship",
  "sponsor": "Google LLC",
  "source_url": "https://buildyourfuture.withgoogle.com/scholarships/google-scholarship",
  "description": "The Google Generation Scholarship recognizes outstanding students in computer science and computer engineering.",
  "eligibility_text": "Must be enrolled full-time at a four-year university studying computer science, computer engineering, or a closely related technical field. Open to all US and Canadian students regardless of state.",
  "amount_min": 10000.0,
  "amount_max": 10000.0,
  "deadline": "2027-12-01",
  "cycle": { "recurring": true, "opens_month": null, "deadline_month": 12 },
  "status": "unknown",
  "education_level": "undergraduate",
  "grade_levels": ["college_1", "college_2", "college_3", "college_4"],
  "majors_allowed": ["Computer Science", "Computer Engineering"],
  "states_allowed": [],
  "counties_allowed": [],
  "min_gpa": null,
  "citizenship": null,
  "need_based": null,
  "first_gen_only": null,
  "gender": null,
  "heritage": [],
  "military_family": null,
  "disability": null,
  "religion": null,
  "employer_restricted": [],
  "membership_required": [],
  "min_test_scores": { "sat": null, "act": null },
  "requirements": {
    "essay": true,
    "essay_prompts": [],
    "recommendation_letters": null,
    "transcript": true,
    "fafsa": null,
    "video_or_portfolio": null,
    "interview": null
  },
  "renewal_terms": null,
  "keywords": ["computer science", "computer engineering", "technology", "undergraduate", "diversity"],
  "trust": "unverified",
  "provenance": {
    "added_on": "2026-09-12",
    "verified_on": "2026-09-12",
    "verified_by": "verify_catalog",
    "source_kind": "sponsor_site"
  },
  "notes": "Migrated from data/static_feed/scholarships.json. Deadline and status not yet confirmed against source_url."
}
