{
  "amount_max": 3000.0,
  "amount_min": 2500.0,
  "catalog_id": "afcea-rotc-scholarship",
  "citizenship": "US",
  "counties_allowed": [],
  "cycle": {
    "deadline_month": 5,
    "opens_month": null,
    "recurring": true
  },
  "deadline": null,
  "description": "Awards of $2,500-$3,000 for a sophomore or junior actively enrolled in an ROTC program and pursuing a STEM major.",
  "disability": null,
  "education_level": "undergraduate",
  "eligibility_text": "Must be actively enrolled in an Army, Navy, Marine Corps or Air Force ROTC program. Must be a sophomore or junior at the time of application; freshmen and seniors are not eligible. Must have a minimum overall GPA of 3.0. Must be a U.S. citizen or permanent resident. Must be enrolled full-time at an accredited college or university, pursuing a STEM-related major aligned with the mission of AFCEA.",
  "employer_restricted": [],
  "first_gen_only": null,
  "gender": null,
  "grade_levels": [
    "college_2",
    "college_3"
  ],
  "heritage": [],
  "keywords": [
    "ROTC",
    "military",
    "STEM",
    "sophomore",
    "junior"
  ],
  "majors_allowed": [
    "Computer Science",
    "Computer Engineering",
    "Electrical Engineering",
    "Engineering",
    "Mathematics",
    "Physics"
  ],
  "membership_required": [],
  "military_family": true,
  "min_gpa": 3.0,
  "min_test_scores": {
    "act": null,
    "sat": null
  },
  "need_based": null,
  "notes": "Split out of the retired 'afcea-stem-scholarship' umbrella on 2026-09-19. The umbrella averaged 13 named awards into eligibility true of none of them. One record for the ROTC family ($2,500 general, plus the $3,000 VADM Jon L. Boyes, Joan Bowden and Mort Marks awards), which share this page's eligibility and differ only by branch and amount. Requires a nomination letter from a PMS, PNS, PAS or Commanding Officer in addition to a professor's recommendation. Page status on 2026-09-19: 'Applications closed!'. The page publishes no application deadline; 'no later than May 1, 2026' is the mailed-documents date for the closed cycle, recorded as cycle.deadline_month 5.",
  "provenance": {
    "added_on": "2026-09-19",
    "source_kind": "sponsor_site",
    "verified_by": "daedwards06",
    "verified_on": "2026-09-26"
  },
  "religion": null,
  "renewal_terms": null,
  "requirements": {
    "essay": null,
    "essay_prompts": [],
    "fafsa": null,
    "interview": null,
    "recommendation_letters": 2,
    "transcript": true,
    "video_or_portfolio": null
  },
  "source_url": "https://www.afcea.org/rotc-scholarships",
  "sponsor": "AFCEA Educational Foundation",
  "states_allowed": [],
  "status": "closed",
  "title": "AFCEA ROTC Scholarships",
  "trust": "verified_local"
}