{
  "amount_max": 1000.0,
  "amount_min": 1000.0,
  "catalog_id": "clyde-and-dezaree-brackett-family-scholarship",
  "citizenship": null,
  "counties_allowed": [
    "Gaston"
  ],
  "cycle": {
    "deadline_month": 3,
    "opens_month": null,
    "recurring": true
  },
  "deadline": null,
  "description": "$1,000 for Gaston County high school graduates showing academic promise, character, and financial need.",
  "disability": null,
  "education_level": "high school",
  "eligibility_text": "Gaston County high school graduates pursuing college or advanced technical education. Awards are based on academics, character and financial need.",
  "employer_restricted": [],
  "first_gen_only": null,
  "gender": null,
  "grade_levels": [
    "12"
  ],
  "heritage": [],
  "keywords": [
    "gaston county",
    "financial need"
  ],
  "majors_allowed": [],
  "membership_required": [],
  "military_family": null,
  "min_gpa": null,
  "min_test_scores": {
    "act": null,
    "sat": null
  },
  "need_based": true,
  "notes": "Seeded 2026-09-26 by Claude (Catalog Integrity Task 2.2, Gaston/Mecklenburg pass). Not verified: open the source before setting trust to verified_local. Prefill proposed: amount_min=1000.0, amount_max=1000.0, counties_allowed=['Gaston'].",
  "provenance": {
    "added_on": "2026-09-26",
    "checked_by": null,
    "checked_on": null,
    "source_kind": "community_foundation",
    "verified_by": "daedwards06",
    "verified_on": "2026-09-26"
  },
  "religion": null,
  "renewal_terms": null,
  "requirements": {
    "essay": null,
    "essay_prompts": [],
    "fafsa": null,
    "interview": null,
    "recommendation_letters": null,
    "transcript": null,
    "video_or_portfolio": null
  },
  "source_url": "https://www.cfgaston.org/portfolio-item/clyde-and-dezaree-brackett-scholarship/",
  "sponsor": "Gaston Community Foundation",
  "states_allowed": [
    "NC"
  ],
  "status": "upcoming",
  "title": "Clyde & Dezaree Brackett Family Scholarship",
  "trust": "verified_local"
}