{
  "catalog_id": "collegiate-inventors-competition",
  "title": "Collegiate Inventors Competition",
  "sponsor": "National Inventors Hall of Fame",
  "source_url": "https://collegiateinventors.org/",
  "description": "Annual competition honoring the most outstanding inventions and innovations by college and university students.",
  "eligibility_text": "Open to full-time undergraduate or graduate students at accredited US colleges. Students in all majors are eligible. No state restrictions.",
  "amount_min": 5000.0,
  "amount_max": 15000.0,
  "deadline": "2027-06-05",
  "cycle": { "recurring": true, "opens_month": null, "deadline_month": 6 },
  "status": "unknown",
  "education_level": "undergraduate",
  "grade_levels": ["college_1", "college_2", "college_3", "college_4"],
  "majors_allowed": [],
  "states_allowed": [],
  "counties_allowed": [],
  "min_gpa": null,
  "citizenship": null,
  "need_based": null,
  "first_gen_only": null,
  "gender": null,
  "heritage": [],
  "military_family": null,
  "disability": null,
  "religion": null,
  "employer_restricted": [],
  "membership_required": [],
  "min_test_scores": { "sat": null, "act": null },
  "requirements": {
    "essay": false,
    "essay_prompts": [],
    "recommendation_letters": null,
    "transcript": null,
    "fafsa": null,
    "video_or_portfolio": true,
    "interview": true
  },
  "renewal_terms": null,
  "keywords": ["innovation", "invention", "undergraduate", "competition", "STEM"],
  "trust": "unverified",
  "provenance": {
    "added_on": "2026-09-12",
    "verified_on": null,
    "verified_by": null,
    "source_kind": "sponsor_site"
  },
  "notes": "Migrated from data/static_feed/scholarships.json. Entry requires an invention submission and a faculty advisor rather than an essay; deadline and status not yet confirmed against source_url."
}
