{
  "amount_max": 20000.0,
  "amount_min": 20000.0,
  "catalog_id": "george-and-patricia-barnard-scholarship",
  "citizenship": null,
  "counties_allowed": [
    "Gaston"
  ],
  "cycle": {
    "deadline_month": 3,
    "opens_month": null,
    "recurring": true
  },
  "deadline": null,
  "description": "$20,000 ($5,000 a year) plus mentoring for one Gaston County senior who has succeeded despite adversity.",
  "disability": null,
  "education_level": "high school",
  "eligibility_text": "Gaston County public, private, or charter high school senior and Gaston County resident; GPA 3.0 or better; college preparatory course of study; extracurriculars, leadership, and strong financial need. Deadline in March (date changes each year); apply through the high school counselor.",
  "employer_restricted": [],
  "first_gen_only": null,
  "gender": null,
  "grade_levels": [
    "12"
  ],
  "heritage": [],
  "keywords": [
    "gaston county",
    "adversity",
    "mentoring",
    "financial need"
  ],
  "majors_allowed": [],
  "membership_required": [],
  "military_family": null,
  "min_gpa": 3.0,
  "min_test_scores": {
    "act": null,
    "sat": null
  },
  "need_based": true,
  "notes": "Seeded 2026-09-26 by Claude (Catalog Integrity Task 2.2, Gaston/Mecklenburg pass). Not verified: open the source before setting trust to verified_local. Prefill proposed: amount_min=5000.0, amount_max=20000.0, min_gpa=3.0, counties_allowed=['Gaston'].",
  "provenance": {
    "added_on": "2026-09-26",
    "checked_by": null,
    "checked_on": null,
    "source_kind": "community_foundation",
    "verified_by": "daedwards06",
    "verified_on": "2026-09-26"
  },
  "religion": null,
  "renewal_terms": "$5,000 a year, renewable for three more years; includes mentoring and a one-time Stultz Internship stipend.",
  "requirements": {
    "essay": null,
    "essay_prompts": [],
    "fafsa": null,
    "interview": null,
    "recommendation_letters": null,
    "transcript": null,
    "video_or_portfolio": null
  },
  "source_url": "https://www.cfgaston.org/portfolio-item/george-and-patricia-barnard-scholarship/",
  "sponsor": "Gaston Community Foundation",
  "states_allowed": [
    "NC"
  ],
  "status": "upcoming",
  "title": "George and Patricia Barnard \"We Believe in You!\" Scholarship",
  "trust": "verified_local"
}